shop_name,business_type,owner_name,phone,email,address,city,business_hours,url,domain,site_type,score,grade,reasons
ameblo,不明,,0046209871,info@a-kokoro.com,4706.html どうぞよろしくお願い致します。 アクセス アクセス ※2016年2月に移転いたし,神奈川県,,https://ameblo.jp/musashikosugi-tr/,ameblo.jp,ameblo,70,A,ameblo; no_pricing; no_booking; no_profile
メンズエステ体験談・口コミ投稿サイト 男のお得情報局,エステ,本体験談に掲載出来て いない情報や,023-09-0815,mensinformation.otoko@gmail.com,町メンエス『LIRICA OSAKA』 東京都福生市メンエス『NATURA(ナチュラ)』 神奈川県相模原メンズエステ『NeoNATURA』 メンズエステ人気ランキング[エリア別TOP10] カテゴリー,中央区,,https://mensinformation.net/kanagawa/mans-preasure-spa-kawasaki1/,mensinformation.net,wordpress,60,A,wordpress; no_booking; no_access
メディカルプライベートサロン,マッサージ,深眠,076-4753-8303,intl-segmenter@11.7.10,,川崎市,,https://www.lamano-medical.com/price,www.lamano-medical.com,wix,60,A,wix; no_booking; no_access
脊椎セラピーサロンフェリシモ,ヘアサロン,,044-888-9553,intl-segmenter@11.7.10,神奈川県川崎市高津区下作延3-18-2 地下1階 電話番号： 044-888-9553 ※美容室テレ,神奈川県,,https://www.therese-hair.com/,www.therese-hair.com,wix,60,A,wix; no_booking; no_profile
自然療法専門サロン,エステ,オーナー セラピスト,080-3040-4088,,オーナー セラピスト 【松崎 ゆかり】 セラピスト歴：22年 【資格・会員】 ・JAAアロマセラピス,,10:00〜21:00,https://peraichi.com/landing_pages/view/forever2013,peraichi.com,peraichi,50,B,peraichi; no_access
心と体のいやしサロンORISA～オリサ～,マッサージ,,02009170000,orisaorisa.kenkoubi@gmail.com,心と体のセラピーサロン｜川崎市高津区のヒーリングサロンならオリサ 心と体のいやしサロン ORISA～オリサ～ 「心と体の繋がり」・・・心と体のヒーリングで今ここに在り続ける私 ボディ・,川崎市,,https://orisaorisa.com/,orisaorisa.com,ameblo,50,B,ameblo; no_access
AromaStone Rikko,スピリチュアル,,076-4753-8303,intl-segmenter@11.7.10,きほぐされる 贅沢な時間をお約束します 神奈川県川崎市にあるパーソナルサロンです アロマテラピーとストーンセラピーを融合させたオリジナルの施術です Rikkoでは、お客様にゆったりとした時間をお過ごし,神奈川県,,https://www.rikko-stone.jp/,www.rikko-stone.jp,wix,40,B,wix
en,マッサージ,,076-4753-8303,en.salon0321@gmail.com,,川崎市,,https://www.en0321.com/,www.en0321.com,wix,40,B,wix
toto-raku | ハイパーエナジーセラピー導入のプライベートサロン,エステ,,070-3841-5321,,-5321 About 自律神経を整えることで 不調に根本からアプローチ 「整えること」で、わたしを,神奈川県,,https://www.toto-raku.jp/,www.toto-raku.jp,wordpress,40,B,wordpress
city,不明,,07206811910,,/Root 213 0 R/Size 363/Type/XRef/W[1 3 1]>>stream,川崎市,,https://www.city.kawasaki.jp/170/cmsfiles/contents/0000054/54365/2014.3kawasakishi-hensen.pdf,www.city.kawasaki.jp,custom,40,B,no_pricing; no_booking; no_access; no_profile
